{
  "$schema": "https://json-schema.org/draft/2020-12/schema",
  "schema_id": "VID-IMPL-P00-003A-WAVEFORM-INPUT",
  "schema_version": "0.1.0-p00",
  "title": "Waveform request envelope schema",
  "description": "Waveform dispatch envelope for deterministic cache-key synthesis and admission gating.",
  "type": "object",
  "required": [
    "operation_id",
    "operation_version",
    "implementation_id",
    "implementation_profile_id",
    "input_schema_id",
    "output_schema_id",
    "transport",
    "requested_capabilities",
    "requested_output_capabilities",
    "input_ports",
    "output_ports",
    "staged_lease",
    "launch_policy",
    "representation",
    "parameters"
  ],
  "properties": {
    "operation_id": {"type": "string", "minLength": 1},
    "operation_version": {"type": "string", "minLength": 1},
    "implementation_id": {"type": "string", "minLength": 1},
    "implementation_profile_id": {"type": "string", "minLength": 1},
    "input_schema_id": {"type": "string", "minLength": 1},
    "output_schema_id": {"type": "string", "minLength": 1},
    "transport": {"type": "string", "enum": ["local-staged-file"]},
    "requested_capabilities": {
      "type": "array",
      "minItems": 1,
      "items": {"type": "string"}
    },
    "requested_output_capabilities": {
      "type": "array",
      "items": {"type": "string"}
    },
    "input_ports": {
      "type": "array",
      "minItems": 1,
      "items": {
        "type": "object",
        "required": ["order", "schema_id", "content_type", "port_type", "identity", "revision", "sample_range"],
        "properties": {
          "order": {"type": "integer", "minimum": 0},
          "schema_id": {"type": "string", "minLength": 1},
          "content_type": {"type": "string", "minLength": 1},
          "port_type": {"type": "string", "enum": ["waveform_request"]},
          "identity": {"type": "string", "minLength": 1},
          "revision": {"type": "string", "minLength": 1},
          "sample_range": {"type": "string", "minLength": 1}
        },
        "additionalProperties": false
      }
    },
    "output_ports": {
      "type": "array",
      "minItems": 1,
      "items": {
        "type": "object",
        "required": ["order", "port_id", "port_type", "schema_id", "max_bytes", "max_nesting"],
        "properties": {
          "order": {"type": "integer", "minimum": 0},
          "port_id": {"type": "string", "minLength": 1},
          "port_type": {"type": "string", "enum": ["waveform_artifact", "waveform_error", "waveform_peak_bulk"]},
          "schema_id": {"type": "string", "minLength": 1},
          "max_bytes": {"type": "integer", "minimum": 0},
          "max_nesting": {"type": "integer", "minimum": 1}
        },
        "additionalProperties": false
      }
    },
    "representation": {
      "type": "object",
      "required": ["sample_rate", "channel_count", "target_timebase", "max_window_samples"],
      "properties": {
        "sample_rate": {"type": "integer", "minimum": 1},
        "channel_count": {"type": "integer", "minimum": 1},
        "target_timebase": {
          "type": "array",
          "items": {"type": "integer"},
          "minItems": 2,
          "maxItems": 2
        },
        "max_window_samples": {"type": "integer", "minimum": 1}
      },
      "additionalProperties": false
    },
    "launch_policy": {
      "type": "object",
      "required": ["use_shell", "use_path_lookup", "user_supplied_options"],
      "properties": {
        "use_shell": {"type": "boolean"},
        "use_path_lookup": {"type": "boolean"},
        "user_supplied_options": {"type": "boolean"}
      },
      "additionalProperties": false
    },
    "staged_lease": {
      "type": "object",
      "required": [
        "lease_id",
        "lease_epoch",
        "minimum_acceptable_lease_epoch",
        "immutable",
        "source_sha256",
        "source_length",
        "staged_copy_identity",
        "staged_copy_sha256",
        "staged_copy_length",
        "observed_staged_copy_identity",
        "observed_staged_copy_sha256",
        "observed_staged_copy_length",
        "access_scope",
        "expires_at",
        "manifest_digest",
        "logical_source_ref",
        "observed_fence_token",
        "expected_fence_token"
      ],
      "properties": {
        "lease_id": {"type": "string", "minLength": 1},
        "lease_epoch": {"type": "integer", "minimum": 0},
        "minimum_acceptable_lease_epoch": {"type": "integer", "minimum": 0},
        "immutable": {"type": "boolean"},
        "source_sha256": {"type": "string", "pattern": "^[A-Fa-f0-9]{64}$"},
        "source_length": {"type": "integer", "minimum": 0},
        "staged_copy_identity": {"type": "string", "minLength": 1},
        "staged_copy_sha256": {"type": "string", "pattern": "^[A-Fa-f0-9]{64}$"},
        "staged_copy_length": {"type": "integer", "minimum": 0},
        "observed_staged_copy_identity": {"type": "string", "minLength": 1},
        "observed_staged_copy_sha256": {"type": "string", "pattern": "^[A-Fa-f0-9]{64}$"},
        "observed_staged_copy_length": {"type": "integer", "minimum": 0},
        "access_scope": {"type": "string", "minLength": 1},
        "expires_at": {
          "type": "string",
          "pattern": "^\\d{4}-\\d{2}-\\d{2}T\\d{2}:\\d{2}:\\d{2}(?:\\.\\d+)?(?:Z|[+\\-]\\d{2}:\\d{2})$"
        },
        "manifest_digest": {"type": "string", "pattern": "^[A-Fa-f0-9]{64}$"},
        "logical_source_ref": {"type": "string", "minLength": 1},
        "observed_fence_token": {"type": "string", "minLength": 1},
        "expected_fence_token": {"type": "string", "minLength": 1}
      },
      "additionalProperties": false
    },
    "parameters": {
      "type": "object",
      "required": ["representation", "limits", "retry_profile"],
      "properties": {
        "representation": {
          "type": "object",
          "required": ["sample_rate", "channel_count", "target_timebase", "max_window_samples"],
          "properties": {
            "sample_rate": {"type": "integer", "minimum": 1},
            "channel_count": {"type": "integer", "minimum": 1},
            "target_timebase": {
              "type": "array",
              "items": {"type": "integer"},
              "minItems": 2,
              "maxItems": 2
            },
            "max_window_samples": {"type": "integer", "minimum": 1}
          },
          "additionalProperties": false
        },
        "limits": {
          "type": "object",
          "required": ["wall_seconds", "cpu_seconds", "resident_memory_bytes", "stream_count"],
          "properties": {
            "wall_seconds": {"type": "integer", "minimum": 1},
            "cpu_seconds": {"type": "integer", "minimum": 1},
            "resident_memory_bytes": {"type": "integer", "minimum": 1},
            "stream_count": {"type": "integer", "minimum": 1}
          }
        },
        "retry_profile": {"type": "string", "minLength": 1}
      }
    }
  },
  "additionalProperties": false
}
